<?xml version="1.0" encoding="UTF-8"?>
<!ELEMENT konyvek (konyv+)>
<!ELEMENT konyv (cim,ev,kiado,szerzo+, kivonat?)>
<!ELEMENT cim (#PCDATA)>
<!ELEMENT ev (#PCDATA)>
<!ELEMENT kiado (#PCDATA)>
<!ELEMENT kivonat (#PCDATA)>
<!ELEMENT szerzo (#PCDATA)>
<!ATTLIST konyv id ID #REQUIRED>